{
  "schema_version": 1,
  "composition_id": "pf005-balanced-review-intake-v1",
  "corpus_id": "koguard-pf005-balanced-review-intake-v1",
  "split": "tuning",
  "selection": "stable-sha256-rank-v1",
  "max_source_share": 0.3,
  "sources": [
    {
      "source_id": "curse-detection-data",
      "corpus_path": "../annotation-work/pf005-after-batch-001.adjudicated.json",
      "expected_corpus_id": "koguard-curse-review-intake-v1",
      "quota": 750
    },
    {
      "source_id": "kote",
      "corpus_path": "../corpus/tuning/kote-review-intake-v1.json",
      "expected_corpus_id": "koguard-kote-review-intake-v1",
      "quota": 750
    },
    {
      "source_id": "beep-korean-hate-speech",
      "corpus_path": "../corpus/tuning/beep-review-intake-v1.json",
      "expected_corpus_id": "koguard-beep-review-intake-v1",
      "quota": 750
    },
    {
      "source_id": "koguard-curated-policy",
      "corpus_path": "../corpus/tuning/curated-policy-slices-v1.json",
      "expected_corpus_id": "koguard-curated-policy-slices-v1",
      "quota": 250
    }
  ]
}
